"Authors","Author full names","Author(s) ID","Title","Year","Source title","Volume","Issue","Art. No.","Page start","Page end","Page count","Cited by","DOI","Link","Abstract","Author Keywords","Index Keywords","Document Type","Publication Stage","Open Access","Source","EID"
"Wu X.; Jin Z.; Zhou J.; Duan C.","Wu, Xiaodong (57544055700); Jin, Zhigang (7403625972); Zhou, Junyi (58479154900); Duan, Chenxu (57224503873)","57544055700; 7403625972; 58479154900; 57224503873","Quantum walks-based classification model with resistance for cloud computing attacks","2023","Expert Systems with Applications","232","","120894","","","","0","10.1016/j.eswa.2023.120894","https://www.scopus.com/inward/record.uri?eid=2-s2.0-85164282421&doi=10.1016%2fj.eswa.2023.120894&partnerID=40&md5=5afc85790204770ded857c0a47933378","Cloud computing is considerably investigable and adoptable in both industry and academia, and Software Defined Networking (SDN) has been applied in cloud computing. Although SDN mitigates some security issues in cloud computing, new security issues related to its own architecture are also introduced. In this paper, we propose a quantum walks-based classification model which is available for intrusion detection in cloud computing. The proposed model concentrates feature information of data via Principal Component Analysis, and then aggregates the concentrated data in the way of quantum walks by a training-free clustering algorithm. The clustering algorithm constructs coin transformation and conditional shift transformation based on transition probabilities to move similar data toward each other. To enhance the usability of the proposed model in cloud computing security, we propose a new cloud architecture which adds security layer in SDN to ponder the protection of cloud computing fundamentally, and simplify transition probabilities equations of clustering algorithm without affecting clustering accuracy, decreasing the time complexity from O(nk2) to O(nk). The experimental results on popular datasets (Accuracy: 99.4% on InSDN, 95.8% on NSL-KDD, 98% on UNSW-NB15 and 96.4% on CSE-CIC-IDS2018) revealed that the proposed model is effective dealing with attacks on SDN-based cloud computing, and is able to maintain stable and excellent attack identification ability under different traffic intensities. © 2023 Elsevier Ltd","Classification model; Cloud computing security; Clustering algorithm; Intrusion detection; Quantum walks; Software defined networking","Cloud security; Clustering algorithms; Computer architecture; Metadata; Principal component analysis; Software defined networking; Classification models; Cloud computing securities; Cloud-computing; Feature information; Intrusion-Detection; Principal-component analysis; Quantum walk; Security issues; Software-defined networkings; Transition probabilities; Intrusion detection","Article","Final","","Scopus","2-s2.0-85164282421"
"Raja N.M.; Vegad S.","Raja, Nirav M (55795208200); Vegad, Sudhir (57113696600)","55795208200; 57113696600","An empirical study for the traffic flow rate prediction-based anomaly detection in software-defined networking: a challenging overview","2023","Social Network Analysis and Mining","13","1","72","","","","1","10.1007/s13278-023-01057-0","https://www.scopus.com/inward/record.uri?eid=2-s2.0-85153310542&doi=10.1007%2fs13278-023-01057-0&partnerID=40&md5=c1bb255e5d8209a821ba6bb67f279915","Currently, there is an enormous disturbance regarding privacy in information and communication technology around the scientific community. Since any assault or abnormality in the network can seriously disturb numerous realms like national security, private data storage, social welfare, economic issues, and so on. Consequently, one of the domains for detecting intrusion in the network is anomaly detection domain and it is a wide probe area. Various numerous methods and approaches have developed for anomaly detection. In the network security field, traffic anomaly detection has been a main aspect. The network security domain recognizes assaults in terms of significant deviations from the entrenched regular usage profiles. Nowadays, software-defined networking (SDN) is a new networking model has developed to ease effectual network control and management. This view investigates 50 probe papers focused on traffic flow rate prediction-based anomaly detection in SDN. Furthermore, it presents technique wise classifications like flow counting-based techniques, information theory-based approaches, entropy-based techniques, deep learning (DL)-based approaches, hybrid methods and network methods. An examination includes in an overview based on classification research techniques, toolset used, years of publication, datasets, and evaluation metrics for predicting anomaly in the SDN environment. Lastly, the limitations of surveyed techniques are explained, that encourage investigators for inventing more new techniques for predicting anomaly in SDN. © 2023, The Author(s), under exclusive licence to Springer-Verlag GmbH Austria, part of Springer Nature.","Anomaly detection; Cyber attacks; Deep learning (DL); Software defined network (SDN); Traffic flow rate","Classification (of information); Cybersecurity; Deep learning; Digital storage; Forecasting; Intrusion detection; National security; Network security; Probes; Anomaly detection; Cyber-attacks; Deep learning; Networks security; Prediction-based; Rate predictions; Software defined network; Software-defined networkings; Software-defined networks; Traffic flow rates; Anomaly detection","Article","Final","","Scopus","2-s2.0-85153310542"
"Kumar C.; Biswas S.; Ansari M.S.A.; Govil M.C.","Kumar, Chandan (57208404135); Biswas, Soham (58549963000); Ansari, Md. Sarfaraj Alam (57212615619); Govil, Mahesh Chandra (35812070200)","57208404135; 58549963000; 57212615619; 35812070200","Nature-inspired intrusion detection system for protecting software-defined networks controller","2023","Computers and Security","134","","103438","","","","","10.1016/j.cose.2023.103438","https://www.scopus.com/inward/record.uri?eid=2-s2.0-85168796524&doi=10.1016%2fj.cose.2023.103438&partnerID=40&md5=5d7894efbb7dad98de2d3522cb53f8d2","Software Defined Networks (SDN) is a new emerging networking architecture facilitated by a separate controller. It has a centralized architecture that serves network management and demand fulfillment from a single point. Architecturally, SDN provides lofty benefits, but security measures are a severe concern that prevents universal adoption. If the SDN controller gets compromised, the intruders could ensign the route of network traffic based on their requirements which causes damage to the entire network. These security limitations of SDN get rectified by employing the network intrusion detection system (NIDS). Deploying ML techniques for NIDS helps us to detect the anomalies within SDN. Selecting a minimal number of features is important as it decreases the computation overhead and accelerates the NIDS performances. For feature selection, a combination of k optimal features is selected using the hit-and-trial approach. As a result, it influences the system's durability for intrusion detection and pushes the model toward poor performance. In this study, we present a new hybrid framework for feature selection using Whale Optimisation Algorithm (WOA), Fisher Score (FS), and Information gain (IG), named Whale Optimization Algorithm-Fisher Feature Importance (WOA-F2I). WOA-F2I addresses the challenge of selecting the k number of an optimal subset of features. The evaluation result manifests the WOA-F2I feature selection technique that enhances the performance of the NIDS model, which backs the input for various classifiers- support vector machine, Naive Bayes, logistic regression, and stochastic gradient descent. The proposed feature selection technique also provides better performance for binary class and multi-class attack detection. © 2023 Elsevier Ltd","Dimension reduction; Feature selection; Fisher score; Information gain; Intrusion Detection System; Software Defined Networks; Whale Optimisation Algorithm","Biomimetics; Computer crime; Feature Selection; Gradient methods; Intrusion detection; Software defined networking; Stochastic models; Stochastic systems; Support vector machines; Dimension reduction; Features selection; Fisher score; Information gain; Intrusion Detection Systems; Network intrusion detection systems; Optimization algorithms; Selection techniques; Software-defined networks; Whale optimization algorithm; Controllers","Article","Final","","Scopus","2-s2.0-85168796524"
"Aouad S.; Meghrouni I.E.; Sabri Y.; Hilmani A.; Maizate A.","Aouad, Siham (58535636800); Meghrouni, Issam El (58535628500); Sabri, Yassine (55839017400); Hilmani, Adil (57203802588); Maizate, Abderrahim (55820871000)","58535636800; 58535628500; 55839017400; 57203802588; 55820871000","Security of software defined networks: evolution and challenges","2023","International Journal of Reconfigurable and Embedded Systems","12","3","","384","391","7","0","10.11591/ijres.v12.i3pp384-391","https://www.scopus.com/inward/record.uri?eid=2-s2.0-85167914578&doi=10.11591%2fijres.v12.i3pp384-391&partnerID=40&md5=6fd57ec84fdeb6806f1188f569e23dd4","In software-defined networking (SDN), network traffic is managed by software controllers or application programming interfaces (APIs) rather than hardware components. It differs from traditional networks, which use switches and routers to control traffic. Using SDN, you can create and control virtual networks or traditional hardware networks. Furthermore, OpenFlow allows network administrators to control exact network behavior through centralized control of packet forwarding. For these reasons, SDN has advantages over certain security issues, unlike traditional networks. However, most of the existing vulnerabilities and security threats in the traditional network also impact the SDN network. This document presents the attacks targeting the SDN network and the solutions that protect against these attacks. In addition, we introduce a variety of SDN security controls, such as intrusion detection systems (IDS)/intrusion prevention system (IPS), and firewalls. Towards the end, we outline a conclusion and perspectives. © 2023, Institute of Advanced Engineering and Science. All rights reserved.","Intrusion detection systems; Intrusion prevention system; OpenFlow; Security; Software-defined networking","","Article","Final","","Scopus","2-s2.0-85167914578"
"Yungaicela-Naula N.M.; Vargas-Rosales C.; Pérez-Díaz J.A.","Yungaicela-Naula, Noe M. (57203986401); Vargas-Rosales, Cesar (57693234700); Pérez-Díaz, Jesús A. (58549913000)","57203986401; 57693234700; 58549913000","SDN/NFV-based framework for autonomous defense against slow-rate DDoS attacks by using reinforcement learning","2023","Future Generation Computer Systems","149","","","637","649","12","","10.1016/j.future.2023.08.007","https://www.scopus.com/inward/record.uri?eid=2-s2.0-85168803383&doi=10.1016%2fj.future.2023.08.007&partnerID=40&md5=a806552e8ae9d46e5ec3df7e16224335","The unforeseen and skyrocketed shift in the number of connections to the Internet during the last years has created vast and critical vulnerabilities in networks that cybercriminals have quickly seized to launch high-volume DDoS attacks. Existing tools, such as advanced firewalls or intrusion prevention systems (IPS), cannot handle such an elevated volume of attacks because these solutions are dependent on humans. Therefore, adaptation of the current network security solutions to automated ones is more significant than ever to foster the development of the zero-touch networks and service management (ZSM) paradigm. Building on our preliminary work in this field, in this study, we provide a software-defined networking (SDN)-based framework that automates the detection and mitigation of slow-rate DDoS attacks. The framework uses deep learning (DL) to detect attacks and reinforcement learning (RL) to mitigate them. Furthermore, a network function virtualization (NFV)-assisted moving target defense (MTD) mechanism is included to amplify the effectiveness and flexibility of the solution. The framework is tested on a simulated network using open-source tools, namely Open Network Operating System (ONOS), Containernet, Apache Web Server, and Docker. The source code of a prototype of the framework is shared, which can be used and improved by interested researchers. Finally, the experimental results demonstrate that RL agents learn optimal DDoS mitigation policies in different scenarios and that they quickly adapt to new conditions that vary in short periods of time. © 2023 Elsevier B.V.","Moving target defense (MTD); Network function virtualization (NFV); Reinforcement learning (RL); Slow-rate DDoS; Software defined networking (SDN); Zero touch networks and service management (ZSM)","Computer system firewalls; Cybersecurity; Deep learning; Denial-of-service attack; Network security; Open source software; Open systems; Reinforcement learning; Software defined networking; Transfer functions; Virtual reality; Moving target defense; Network and service managements; Network function virtualization; Reinforcement learning; Reinforcement learnings; Slow-rate DDoS; Software defined networking; Software-defined networkings; Zero touch network and service management (zero-touch network and service management); Network function virtualization","Article","Final","","Scopus","2-s2.0-85168803383"
"Cao W.; Gu G.; Zhang L.; Peng C.; He H.","Cao, Wanke (56161571400); Gu, Guangjian (57392736100); Zhang, Lei (56028400300); Peng, Chunlei (57682405700); He, Hongwen (7402291608)","56161571400; 57392736100; 56028400300; 57682405700; 7402291608","Analysis and Synthesis of Cooperative Adaptive Cruise Control Against the Hetero-Integration Poly-Net Loop Delays","2023","IEEE Transactions on Industrial Electronics","70","12","","12913","12925","12","0","10.1109/TIE.2023.3236081","https://www.scopus.com/inward/record.uri?eid=2-s2.0-85147281620&doi=10.1109%2fTIE.2023.3236081&partnerID=40&md5=a64ed59fd1b58ddaa2fbc76f2ebbb933","Cooperative adaptive cruise control (CACC) is a promising technology for improving the capacity and energy efficiency of the ground transportation system. In this article, a novel CACC control scheme is proposed to deal with the adverse impacts of both inter- and intra-vehicle network delays. First, a hetero-integration Poly-Net (PN) loop delay analysis method is presented to clarify the system delays in CACC considering both inter- and intra-vehicle network influences. A mathematic equation is put forward to calculate the upper bound of the PN loop delays. Then, a collaborative software-defined network scheme is presented to deal with the PN loop delays, which consists of the application/strategy, network-control and network-data planes. In the network-control plane, a fraction-type basic period scheduling method is adopted. In the application/strategy plane, a delay-tolerant model predictive controller is designed for decision-making while a combination of an H∞ controller and a linear quadratic regulator is adopted for acceleration tracking control against local intra-vehicle network delays. Finally, the proposed scheme is verified under a variety of scenarios based on comprehensive hardware-in-the-loop tests.  © 1982-2012 IEEE.","Collaborative software-defined network (CSDN); cooperative adaptive cruise control (CACC); delay-tolerant model predictive controller; network delays","Acceleration; Adaptive control systems; Adaptive cruise control; Application programs; Decision making; Energy efficiency; Job analysis; Software defined networking; Vehicles; Collaborative software-defined network; Collaborative softwares; Cooperative adaptive cruise control; Delay; Delay tolerant; Delay-tolerant model predictive controller; Model predictive controllers; Network-delay; Predictive models; Software-defined networks; Task analysis; Tolerant models; Controllers","Article","Final","","Scopus","2-s2.0-85147281620"
"Rafique W.; Hafid A.S.; Cherkaoui S.","Rafique, Wajid (57196054591); Hafid, Abdelhakim Senhaji (8725767200); Cherkaoui, Soumaya (7003710939)","57196054591; 8725767200; 7003710939","SoftCaching: A framework for caching node selection and routing in Software-Defined Information Centric Internet of Things","2023","Computer Networks","235","","109966","","","","0","10.1016/j.comnet.2023.109966","https://www.scopus.com/inward/record.uri?eid=2-s2.0-85168544200&doi=10.1016%2fj.comnet.2023.109966&partnerID=40&md5=969ac895542f43b66e5cb5cb541b7f08","A considerable demand for Internet of Things (IoT) services is causing exponential growth in Internet traffic. Software-Defined Networking (SDN) and Information-Centric Networking (ICN) are complementary technologies for IoT services provisioning that reduce network traffic and service provisioning delays by caching content at intermediate nodes in the network. Existing research on Software-Defined Information-Centric Networking (SDICN) for IoT service provisioning suffers from two major challenges: (a) optimal caching node selection and (b) optimal path computation from content consumers to caching nodes based on end-to-end delay and link utilization constraints. We propose a SoftCaching framework that optimizes caching node selection for content publishers and computes the optimal routing path to caching nodes for content consumers. It computes optimal locations for caching nodes and finds optimal routing paths for IoT services to access cached content. SoftCaching analyzes network traffic on all nodes in the network and collects traffic metrics. It estimates the best possible caching nodes by using Waypoint Enforcement (WPE) and solving the traffic matrix using Singular Value Decomposition (SVD) and QR Factorization. WPE and SVD-based QR factorization provide optimal locations to cache the content for IoT services. Subsequently, SoftCaching uses a constraint-based shortest path algorithm to compute the optimal routing path from content consumers to caching nodes. We make sure that the caching node and the routing path selection follow delay and link utilization constraints. We perform extensive experiments for evaluation, and the results show that SoftCaching outperforms state-of-the-art caching schemes in terms of delay, link load, hop count, path stretch, and energy consumption metrics. © 2023 Elsevier B.V.","Caching; ICN; IoT; Routing path; SDN; Services provisioning; Waypoint enforcement","Energy utilization; Factorization; Quality of service; Singular value decomposition; Caching; Information-centric networkings; Network traffic; Node selection; Optimal routing; Routing path; Service provisioning; Software-defined networkings; Waypoint enforcement; Waypoints; Internet of things","Article","Final","","Scopus","2-s2.0-85168544200"
"Abizar M.; Syahputra M.F.S.I.; Habibullah A.R.; Aditya C.S.K.; Sumadi F.D.S.","Abizar, Muhammad (58527567800); Syahputra, Muhammad Ferry Septian Ihzanor (58527343800); Habibullah, Ahmad Rizky (58527902000); Aditya, Christian Sri Kusuma (57189058223); Sumadi, Fauzi Dwi Setiawan (57209974209)","58527567800; 58527343800; 58527902000; 57189058223; 57209974209","Low-rate distributed denial of service attacks detection in software defined network-enabled internet of things using machine learning combined with feature importance","2023","IAES International Journal of Artificial Intelligence","12","4","","1974","1984","10","0","10.11591/ijai.v12.i4.pp1974-1984","https://www.scopus.com/inward/record.uri?eid=2-s2.0-85167334474&doi=10.11591%2fijai.v12.i4.pp1974-1984&partnerID=40&md5=c87782de25882fee77f8cf5487059cc5","One of the main challenges in developing the internet of things (IoT) is the existence of availability problems originated from the low-rate distributed denial of service attacks (LRDDoS). The complexity of IoT makes the LRDDoS hard to detect because the attack flow is performed similarly to the regular traffic. Integration of software defined IoT (SDN-Enabled IoT) is considered an alternative solution for overcoming the specified problem through a single detection point using machine learning approaches. The controller has a resource limitation for implementing the classification process. Therefore, this paper extends the usage of Feature Importance to reduce the data complexity during the model generation process and choose an appropriate feature for generating an efficient classification model. The research results show that the Gaussian Naïve Bayes (GNB) produced the most effective outcome. GNB performed better than the other algorithms because the feature reduction only selected the independent feature, which had no relation to the other features. © 2023, Institute of Advanced Engineering and Science. All rights reserved.","Feature importance; Internet of things; Low-rate distributed denial of; Machine learning; service; Software defined network","","Article","Final","All Open Access; Gold Open Access","Scopus","2-s2.0-85167334474"
"Lu Y.; Chen Y.; Xu X.; Fu Q.; Chen J.; Liu L.","Lu, You (55809779100); Chen, Yuhao (58093991900); Xu, Xiao (57237139900); Fu, Qiming (35193815600); Chen, Jianping (55976802000); Liu, Lanhui (56434718900)","55809779100; 58093991900; 57237139900; 35193815600; 55976802000; 56434718900","A Sub-flow Adaptive Multipath Routing Algorithm for Data Centre Network","2023","International Journal of Computational Intelligence Systems","16","1","25","","","","0","10.1007/s44196-023-00199-5","https://www.scopus.com/inward/record.uri?eid=2-s2.0-85149555251&doi=10.1007%2fs44196-023-00199-5&partnerID=40&md5=024048ea956885538423ff3b75fc64fe","In response to the fast and intensive traffic changes and the presence of redundant links in the network topology in data centre networks, multipath routing has become the dominant approach. Existing multipath routing algorithms are still inadequate in terms of adapting to dynamic changes in the network state quickly and the cooperation of path selection and sub-flow assignment. Therefore, this paper proposes a sub-flow adaptive multipath routing algorithm for data centre networks (SAMP). The deep deterministic policy gradient (DDPG) algorithm is introduced. DDPG combines deep learning (DL) and reinforcement learning (RL) to implement different network state changes quickly, especially in the process of topology, to achieve dynamic migration of the optimised decisions that have been learned. An adaptive multipath routing model for subflows is established to accomplish collaborative scheduling of path selection and subflow assignment based on the real-time state of the network. The experimental results show that the algorithm can be well adapted to the data centre network, and when compared with several traditional methods, it reduces the latency by an average of 31.3%, improves the task transmission success rate by an average of 14.9%, and increases the throughput by 37.1%. © 2023, The Author(s).","Data center network; Multipath routing; Reinforcement learning; Software defined network; Traffic schedule","Deep learning; Network topology; Routing algorithms; Software defined networking; Adaptive multipath routing; Data center networks; Deterministics; Multi-paths routing; Multipath routing algorithms; Network state; Path selection; Reinforcement learnings; Software-defined networks; Traffic schedule; Reinforcement learning","Article","Final","All Open Access; Gold Open Access","Scopus","2-s2.0-85149555251"
